{
  "$id": "https://hyoban.cc/data/schema/v1/moment.schema.json",
  "$schema": "https://json-schema.org/draft/2020-12/schema",
  "type": "object",
  "properties": {
    "uid": {
      "type": "string",
      "pattern": "^[0-9A-HJKMNP-TV-Z]{26}$"
    },
    "occurredAt": {
      "anyOf": [
        {
          "type": "string",
          "pattern": "^\\d{4}-\\d{2}-\\d{2}$"
        },
        {
          "type": "string",
          "pattern": "^\\d{4}-\\d{2}-\\d{2}T\\d{2}:\\d{2}(?::\\d{2})?(?:Z|[+-]\\d{2}:\\d{2})$"
        }
      ]
    },
    "places": {
      "default": [],
      "type": "array",
      "items": {
        "type": "string",
        "pattern": "^[a-z0-9]+(?:-[a-z0-9]+)*$"
      }
    },
    "text": {
      "type": "string"
    },
    "hidden": {
      "default": false,
      "type": "boolean"
    },
    "media": {
      "default": [],
      "type": "array",
      "items": {
        "oneOf": [
          {
            "type": "object",
            "properties": {
              "uid": {
                "type": "string",
                "pattern": "^[0-9A-HJKMNP-TV-Z]{26}$"
              },
              "alt": {
                "default": "",
                "type": "string"
              },
              "takenAt": {
                "type": "string",
                "pattern": "^\\d{4}-\\d{2}-\\d{2}T\\d{2}:\\d{2}(?::\\d{2})?(?:Z|[+-]\\d{2}:\\d{2})$"
              },
              "local": {
                "type": "object",
                "properties": {
                  "uri": {
                    "type": "string",
                    "minLength": 1
                  },
                  "videoUri": {
                    "type": "string",
                    "minLength": 1
                  },
                  "sha256": {
                    "type": "string",
                    "pattern": "^[0-9a-f]{64}$"
                  },
                  "copied": {
                    "default": false,
                    "type": "boolean"
                  }
                },
                "required": [
                  "uri"
                ],
                "additionalProperties": {}
              },
              "type": {
                "type": "string",
                "const": "image"
              },
              "width": {
                "type": "integer",
                "exclusiveMinimum": 0,
                "maximum": 9007199254740991
              },
              "height": {
                "type": "integer",
                "exclusiveMinimum": 0,
                "maximum": 9007199254740991
              },
              "published": {
                "type": "object",
                "properties": {
                  "key": {
                    "type": "string",
                    "minLength": 1
                  },
                  "contentType": {
                    "type": "string",
                    "format": "starts_with",
                    "pattern": "^image\\/.*"
                  },
                  "bytes": {
                    "type": "integer",
                    "exclusiveMinimum": 0,
                    "maximum": 9007199254740991
                  },
                  "etag": {
                    "type": "string",
                    "pattern": "^[0-9a-f]{32}$"
                  },
                  "width": {
                    "type": "integer",
                    "exclusiveMinimum": 0,
                    "maximum": 9007199254740991
                  },
                  "height": {
                    "type": "integer",
                    "exclusiveMinimum": 0,
                    "maximum": 9007199254740991
                  },
                  "variants": {
                    "default": [],
                    "type": "array",
                    "items": {
                      "type": "object",
                      "properties": {
                        "key": {
                          "type": "string",
                          "minLength": 1
                        },
                        "contentType": {
                          "type": "string",
                          "minLength": 1
                        },
                        "bytes": {
                          "type": "integer",
                          "exclusiveMinimum": 0,
                          "maximum": 9007199254740991
                        },
                        "etag": {
                          "type": "string",
                          "pattern": "^[0-9a-f]{32}$"
                        },
                        "width": {
                          "type": "integer",
                          "exclusiveMinimum": 0,
                          "maximum": 9007199254740991
                        },
                        "height": {
                          "type": "integer",
                          "exclusiveMinimum": 0,
                          "maximum": 9007199254740991
                        }
                      },
                      "required": [
                        "key",
                        "contentType",
                        "bytes",
                        "etag",
                        "width",
                        "height"
                      ],
                      "additionalProperties": {}
                    }
                  }
                },
                "required": [
                  "key",
                  "contentType",
                  "bytes",
                  "etag",
                  "width",
                  "height"
                ],
                "additionalProperties": {}
              }
            },
            "required": [
              "uid",
              "type",
              "width",
              "height"
            ],
            "additionalProperties": {}
          },
          {
            "type": "object",
            "properties": {
              "uid": {
                "type": "string",
                "pattern": "^[0-9A-HJKMNP-TV-Z]{26}$"
              },
              "alt": {
                "default": "",
                "type": "string"
              },
              "takenAt": {
                "type": "string",
                "pattern": "^\\d{4}-\\d{2}-\\d{2}T\\d{2}:\\d{2}(?::\\d{2})?(?:Z|[+-]\\d{2}:\\d{2})$"
              },
              "local": {
                "type": "object",
                "properties": {
                  "uri": {
                    "type": "string",
                    "minLength": 1
                  },
                  "videoUri": {
                    "type": "string",
                    "minLength": 1
                  },
                  "sha256": {
                    "type": "string",
                    "pattern": "^[0-9a-f]{64}$"
                  },
                  "copied": {
                    "default": false,
                    "type": "boolean"
                  }
                },
                "required": [
                  "uri"
                ],
                "additionalProperties": {}
              },
              "type": {
                "type": "string",
                "const": "live-photo"
              },
              "width": {
                "type": "integer",
                "exclusiveMinimum": 0,
                "maximum": 9007199254740991
              },
              "height": {
                "type": "integer",
                "exclusiveMinimum": 0,
                "maximum": 9007199254740991
              },
              "published": {
                "type": "object",
                "properties": {
                  "key": {
                    "type": "string",
                    "minLength": 1
                  },
                  "contentType": {
                    "type": "string",
                    "format": "starts_with",
                    "pattern": "^image\\/.*"
                  },
                  "bytes": {
                    "type": "integer",
                    "exclusiveMinimum": 0,
                    "maximum": 9007199254740991
                  },
                  "etag": {
                    "type": "string",
                    "pattern": "^[0-9a-f]{32}$"
                  },
                  "width": {
                    "type": "integer",
                    "exclusiveMinimum": 0,
                    "maximum": 9007199254740991
                  },
                  "height": {
                    "type": "integer",
                    "exclusiveMinimum": 0,
                    "maximum": 9007199254740991
                  },
                  "variants": {
                    "default": [],
                    "type": "array",
                    "items": {
                      "type": "object",
                      "properties": {
                        "key": {
                          "type": "string",
                          "minLength": 1
                        },
                        "contentType": {
                          "type": "string",
                          "minLength": 1
                        },
                        "bytes": {
                          "type": "integer",
                          "exclusiveMinimum": 0,
                          "maximum": 9007199254740991
                        },
                        "etag": {
                          "type": "string",
                          "pattern": "^[0-9a-f]{32}$"
                        },
                        "width": {
                          "type": "integer",
                          "exclusiveMinimum": 0,
                          "maximum": 9007199254740991
                        },
                        "height": {
                          "type": "integer",
                          "exclusiveMinimum": 0,
                          "maximum": 9007199254740991
                        }
                      },
                      "required": [
                        "key",
                        "contentType",
                        "bytes",
                        "etag",
                        "width",
                        "height"
                      ],
                      "additionalProperties": {}
                    }
                  },
                  "video": {
                    "type": "object",
                    "properties": {
                      "key": {
                        "type": "string",
                        "minLength": 1
                      },
                      "contentType": {
                        "type": "string",
                        "format": "starts_with",
                        "pattern": "^video\\/.*"
                      },
                      "bytes": {
                        "type": "integer",
                        "exclusiveMinimum": 0,
                        "maximum": 9007199254740991
                      },
                      "etag": {
                        "type": "string",
                        "pattern": "^[0-9a-f]{32}$"
                      }
                    },
                    "required": [
                      "key",
                      "contentType",
                      "bytes",
                      "etag"
                    ],
                    "additionalProperties": {}
                  }
                },
                "required": [
                  "key",
                  "contentType",
                  "bytes",
                  "etag",
                  "width",
                  "height",
                  "video"
                ],
                "additionalProperties": {}
              }
            },
            "required": [
              "uid",
              "type",
              "width",
              "height"
            ],
            "additionalProperties": {}
          },
          {
            "type": "object",
            "properties": {
              "uid": {
                "type": "string",
                "pattern": "^[0-9A-HJKMNP-TV-Z]{26}$"
              },
              "alt": {
                "default": "",
                "type": "string"
              },
              "takenAt": {
                "type": "string",
                "pattern": "^\\d{4}-\\d{2}-\\d{2}T\\d{2}:\\d{2}(?::\\d{2})?(?:Z|[+-]\\d{2}:\\d{2})$"
              },
              "local": {
                "type": "object",
                "properties": {
                  "uri": {
                    "type": "string",
                    "minLength": 1
                  },
                  "videoUri": {
                    "type": "string",
                    "minLength": 1
                  },
                  "sha256": {
                    "type": "string",
                    "pattern": "^[0-9a-f]{64}$"
                  },
                  "copied": {
                    "default": false,
                    "type": "boolean"
                  }
                },
                "required": [
                  "uri"
                ],
                "additionalProperties": {}
              },
              "type": {
                "type": "string",
                "const": "video"
              },
              "width": {
                "type": "integer",
                "exclusiveMinimum": 0,
                "maximum": 9007199254740991
              },
              "height": {
                "type": "integer",
                "exclusiveMinimum": 0,
                "maximum": 9007199254740991
              },
              "published": {
                "type": "object",
                "properties": {
                  "key": {
                    "type": "string",
                    "minLength": 1
                  },
                  "contentType": {
                    "type": "string",
                    "format": "starts_with",
                    "pattern": "^video\\/.*"
                  },
                  "bytes": {
                    "type": "integer",
                    "exclusiveMinimum": 0,
                    "maximum": 9007199254740991
                  },
                  "etag": {
                    "type": "string",
                    "pattern": "^[0-9a-f]{32}$"
                  },
                  "poster": {
                    "type": "object",
                    "properties": {
                      "key": {
                        "type": "string",
                        "minLength": 1
                      },
                      "contentType": {
                        "type": "string",
                        "format": "starts_with",
                        "pattern": "^image\\/.*"
                      },
                      "bytes": {
                        "type": "integer",
                        "exclusiveMinimum": 0,
                        "maximum": 9007199254740991
                      },
                      "etag": {
                        "type": "string",
                        "pattern": "^[0-9a-f]{32}$"
                      },
                      "width": {
                        "type": "integer",
                        "exclusiveMinimum": 0,
                        "maximum": 9007199254740991
                      },
                      "height": {
                        "type": "integer",
                        "exclusiveMinimum": 0,
                        "maximum": 9007199254740991
                      },
                      "variants": {
                        "default": [],
                        "type": "array",
                        "items": {
                          "type": "object",
                          "properties": {
                            "key": {
                              "type": "string",
                              "minLength": 1
                            },
                            "contentType": {
                              "type": "string",
                              "minLength": 1
                            },
                            "bytes": {
                              "type": "integer",
                              "exclusiveMinimum": 0,
                              "maximum": 9007199254740991
                            },
                            "etag": {
                              "type": "string",
                              "pattern": "^[0-9a-f]{32}$"
                            },
                            "width": {
                              "type": "integer",
                              "exclusiveMinimum": 0,
                              "maximum": 9007199254740991
                            },
                            "height": {
                              "type": "integer",
                              "exclusiveMinimum": 0,
                              "maximum": 9007199254740991
                            }
                          },
                          "required": [
                            "key",
                            "contentType",
                            "bytes",
                            "etag",
                            "width",
                            "height"
                          ],
                          "additionalProperties": {}
                        }
                      }
                    },
                    "required": [
                      "key",
                      "contentType",
                      "bytes",
                      "etag",
                      "width",
                      "height"
                    ],
                    "additionalProperties": {}
                  }
                },
                "required": [
                  "key",
                  "contentType",
                  "bytes",
                  "etag"
                ],
                "additionalProperties": {}
              }
            },
            "required": [
              "uid",
              "type"
            ],
            "additionalProperties": {}
          }
        ]
      }
    },
    "trip": {
      "type": "string",
      "pattern": "^[a-z0-9]+(?:-[a-z0-9]+)*$"
    },
    "published": {
      "type": "object",
      "properties": {
        "id": {
          "type": "string",
          "pattern": "^(\\d{4})\\/(\\d{2})\\/(\\d{2})-(\\d{2})-([a-z0-9]+(?:-[a-z0-9]+)*)$"
        },
        "slug": {
          "type": "string",
          "pattern": "^[a-z0-9]+(?:-[a-z0-9]+)*$"
        },
        "order": {
          "type": "integer",
          "exclusiveMinimum": 0,
          "maximum": 9007199254740991
        },
        "at": {
          "type": "string",
          "pattern": "^\\d{4}-\\d{2}-\\d{2}T\\d{2}:\\d{2}(?::\\d{2})?(?:Z|[+-]\\d{2}:\\d{2})$"
        }
      },
      "required": [
        "id",
        "slug",
        "order",
        "at"
      ],
      "additionalProperties": {}
    },
    "createdAt": {
      "type": "string",
      "pattern": "^\\d{4}-\\d{2}-\\d{2}T\\d{2}:\\d{2}(?::\\d{2})?(?:Z|[+-]\\d{2}:\\d{2})$"
    },
    "updatedAt": {
      "type": "string",
      "pattern": "^\\d{4}-\\d{2}-\\d{2}T\\d{2}:\\d{2}(?::\\d{2})?(?:Z|[+-]\\d{2}:\\d{2})$"
    }
  },
  "required": [
    "uid",
    "occurredAt",
    "text",
    "createdAt",
    "updatedAt"
  ],
  "additionalProperties": {}
}
