{
  "uid": "01KQVX5PH0XXHSCSK810WW1Q04",
  "occurredAt": "2026-05-05T19:08:04+08:00",
  "places": [
    "xiangyang"
  ],
  "text": "单日800+ 五一2000+，直接把上个月的累积里程超过了。马上要迎来第一个两万公里和保养了。\n五一最后一天是送人回襄阳。发现如果是赶时间的话，下高速充电就不是很可取了。赶上目标充电点故障/排队的话很折磨，不如在有理想充电桩的服务区充电。",
  "hidden": false,
  "media": [
    {
      "uid": "01KQVX5PH1DVT63MHTQ4ZJQFK6",
      "type": "image",
      "alt": "",
      "width": 1280,
      "height": 1280,
      "published": {
        "key": "moments/2026/05/05-01-dan-ri-800-wu-yi-2000-zhi-jie-ba-shang/dan-ri-800-wu-yi-2000-zhi-jie-ba-shang.jpg",
        "contentType": "image/jpeg",
        "bytes": 127915,
        "etag": "47f838f2f071668bfb041de3049ad6b6",
        "width": 1280,
        "height": 1280,
        "variants": [
          {
            "key": "moments/2026/05/05-01-dan-ri-800-wu-yi-2000-zhi-jie-ba-shang/dan-ri-800-wu-yi-2000-zhi-jie-ba-shang-480w.webp",
            "contentType": "image/webp",
            "bytes": 21636,
            "etag": "81067e0ca8dfedaf585dab0f7a464b88",
            "width": 480,
            "height": 480
          },
          {
            "key": "moments/2026/05/05-01-dan-ri-800-wu-yi-2000-zhi-jie-ba-shang/dan-ri-800-wu-yi-2000-zhi-jie-ba-shang-960w.webp",
            "contentType": "image/webp",
            "bytes": 57372,
            "etag": "f92e188a1e150049fb7ab91008c82e80",
            "width": 960,
            "height": 960
          }
        ]
      }
    },
    {
      "uid": "01KQVX5PH23WBSYQHFSB82F2HQ",
      "type": "image",
      "alt": "",
      "width": 1280,
      "height": 1280,
      "published": {
        "key": "moments/2026/05/05-01-dan-ri-800-wu-yi-2000-zhi-jie-ba-shang/dan-ri-800-wu-yi-2000-zhi-jie-ba-shang-2.jpg",
        "contentType": "image/jpeg",
        "bytes": 171965,
        "etag": "1c525d9990ca1531a308e283b2f88717",
        "width": 1280,
        "height": 1280,
        "variants": [
          {
            "key": "moments/2026/05/05-01-dan-ri-800-wu-yi-2000-zhi-jie-ba-shang/dan-ri-800-wu-yi-2000-zhi-jie-ba-shang-2-480w.webp",
            "contentType": "image/webp",
            "bytes": 29336,
            "etag": "132e7e6f218c0e321635ba4bd1412132",
            "width": 480,
            "height": 480
          },
          {
            "key": "moments/2026/05/05-01-dan-ri-800-wu-yi-2000-zhi-jie-ba-shang/dan-ri-800-wu-yi-2000-zhi-jie-ba-shang-2-960w.webp",
            "contentType": "image/webp",
            "bytes": 88548,
            "etag": "281041a6a868e30146a82d50d35ba40e",
            "width": 960,
            "height": 960
          }
        ]
      }
    }
  ],
  "published": {
    "id": "2026/05/05-01-dan-ri-800-wu-yi-2000-zhi-jie-ba-shang",
    "slug": "dan-ri-800-wu-yi-2000-zhi-jie-ba-shang",
    "order": 1,
    "at": "2026-07-30T08:12:13+08:00"
  },
  "createdAt": "2026-05-05T19:08:04+08:00",
  "updatedAt": "2026-09-03T10:44:40+08:00"
}
