{
  "uid": "01KVGA4WHRCXZH8F2ZYG5DTXWJ",
  "occurredAt": "2026-06-20T00:06:43+08:00",
  "places": [],
  "text": "温馨提示\n\n在高速上充了一块七的电后，谁能拒绝卡点来充五毛的低价电呢？",
  "hidden": true,
  "media": [
    {
      "uid": "01KVGA4WHSQPDBZVYE71PENQRC",
      "type": "image",
      "alt": "",
      "width": 1440,
      "height": 1080,
      "published": {
        "key": "moments/2026/06/20-02-wen-xin-ti-shi/wen-xin-ti-shi.webp",
        "contentType": "image/webp",
        "bytes": 57202,
        "etag": "ec2adb3afd4dcd252662b392d7b1684b",
        "width": 1440,
        "height": 1080,
        "variants": [
          {
            "key": "moments/2026/06/20-02-wen-xin-ti-shi/wen-xin-ti-shi-480w.webp",
            "contentType": "image/webp",
            "bytes": 9048,
            "etag": "0afba2ab2328bf9b9408e2bc4e9a2205",
            "width": 480,
            "height": 360
          },
          {
            "key": "moments/2026/06/20-02-wen-xin-ti-shi/wen-xin-ti-shi-960w.webp",
            "contentType": "image/webp",
            "bytes": 22202,
            "etag": "c38e0d0bac89c25aafdb9e2e6a4e786a",
            "width": 960,
            "height": 720
          }
        ]
      }
    }
  ],
  "published": {
    "id": "2026/06/20-02-wen-xin-ti-shi",
    "slug": "wen-xin-ti-shi",
    "order": 2,
    "at": "2026-07-30T08:12:13+08:00"
  },
  "createdAt": "2026-06-20T00:06:43+08:00",
  "updatedAt": "2026-09-03T10:44:40+08:00"
}
