{
  "uid": "01HM8WYQ9RNW9MX5XZMG8ZJGBK",
  "occurredAt": "2024-01-16T18:26:59+08:00",
  "places": [],
  "text": "对于 RSC 和 Suspense 的数据获取的模式我还是很喜欢的。有最新最及时的数据时展示它，没有的时候展示缓存，最次展示一个 Loading。这样用户能最快看到完整的页面。",
  "hidden": true,
  "media": [],
  "published": {
    "id": "2024/01/16-03-dui-yu-rsc-he-suspense-de-shu-ju-huo-qu",
    "slug": "dui-yu-rsc-he-suspense-de-shu-ju-huo-qu",
    "order": 3,
    "at": "2026-07-30T08:12:13+08:00"
  },
  "createdAt": "2024-01-16T18:26:59+08:00",
  "updatedAt": "2026-09-03T10:44:40+08:00"
}
