{
  "uid": "01JVZV8SMRD8VJT85GRP95CJE7",
  "occurredAt": "2025-05-24T08:32:15+08:00",
  "places": [],
  "text": "sqlocal 的链接是https://github.com/DallasHoff/sqlocal",
  "hidden": true,
  "media": [],
  "published": {
    "id": "2025/05/24-02-sqlocal-de-lian-jie-shi",
    "slug": "sqlocal-de-lian-jie-shi",
    "order": 2,
    "at": "2026-07-30T08:12:13+08:00"
  },
  "createdAt": "2025-05-24T08:32:15+08:00",
  "updatedAt": "2026-09-03T10:44:40+08:00"
}
