{
  "uid": "01M3XC9PG04D26CMXNZDX7NGYC",
  "occurredAt": "2026-10-02T12:00:00+08:00",
  "places": ["nanjing-2"],
  "text": "照片在相册里删掉了。",
  "hidden": false,
  "media": [
    {
      "uid": "01M3XC9PG1PJVX9GVVG7M4ZGCK",
      "type": "image",
      "alt": "",
      "width": 100,
      "height": 100
    }
  ],
  "createdAt": "2026-10-02T12:01:00+08:00",
  "updatedAt": "2026-10-02T12:01:00+08:00"
}
