{
  "uid": "01HR3HHGMRG4VMRTCE9TZG8FQJ",
  "occurredAt": "2024-03-04T09:34:07+08:00",
  "places": [],
  "text": "大家喜欢 RSSHub 的话可以给 yy 赞助，还能出现在 yy GitHub 首页和 RSSHub 文档的页面上，简直超值🤩\n\nhttps://github.com/DIYgod/sponsors",
  "hidden": true,
  "media": [],
  "published": {
    "id": "2024/03/04-01-da-jia-xi-huan-rsshub-de-hua-ke-yi-gei",
    "slug": "da-jia-xi-huan-rsshub-de-hua-ke-yi-gei",
    "order": 1,
    "at": "2026-07-30T08:12:13+08:00"
  },
  "createdAt": "2024-03-04T09:34:07+08:00",
  "updatedAt": "2026-09-03T10:44:40+08:00"
}
