{
  "uid": "01HHP5BSGGD4JPNE6Q6FAE7S90",
  "occurredAt": "2023-12-15T15:16:58+08:00",
  "places": [],
  "text": "Vite Glob Import 绝对是我最喜欢的 Vite 的功能，我爱说实话。\nhttps://vitejs.dev/guide/features.html#glob-import",
  "hidden": true,
  "media": [],
  "published": {
    "id": "2023/12/15-01-vite-glob-import-jue-dui-shi-wo-zui-xi-huan",
    "slug": "vite-glob-import-jue-dui-shi-wo-zui-xi-huan",
    "order": 1,
    "at": "2026-07-30T08:12:13+08:00"
  },
  "createdAt": "2023-12-15T15:16:58+08:00",
  "updatedAt": "2026-09-03T10:44:40+08:00"
}
